{
  "version": "poi-taxonomy/v1",
  "note": "Единственный источник правды по таксономии POI. Из него строятся проверки Intake, промпт классификатора, списки XLSX, переводы RU/EN и сверка опций Airtable. Коды неизменны; подписи меняются только вместе с версией и записью в labelHistory.",
  "dispositions": ["route", "exclude", "needs_review"],
  "catalogTargets": ["poi", "hotel", "restaurant", "event", "experience"],

  "entityKinds": [
    { "code": "tourist_poi", "labels": { "ru": "Туристический объект", "en": "Tourist POI" } },
    { "code": "accommodation", "labels": { "ru": "Размещение", "en": "Accommodation" } },
    { "code": "food_service", "labels": { "ru": "Общественное питание", "en": "Food Service" } },
    { "code": "event", "labels": { "ru": "Событие", "en": "Event" } },
    { "code": "experience", "labels": { "ru": "Впечатление с расписанием", "en": "Scheduled Experience" } },
    { "code": "transport_infrastructure", "labels": { "ru": "Транспортная инфраструктура", "en": "Transport Infrastructure" } },
    { "code": "retail_shop", "labels": { "ru": "Магазин", "en": "Retail Shop" } },
    { "code": "service_business", "labels": { "ru": "Коммерческая услуга", "en": "Service Business" } },
    { "code": "unknown", "labels": { "ru": "Не определено", "en": "Unknown" } }
  ],

  "excludeReasons": [
    { "code": "infrastructure_not_catalogued", "labels": { "ru": "Инфраструктура: каталога пока нет", "en": "Infrastructure: no catalogue yet" } },
    { "code": "not_a_destination", "labels": { "ru": "Не является точкой маршрута", "en": "Not a destination" } }
  ],

  "routingPolicy": [
    { "id": "poi_known_type", "entityKind": "tourist_poi", "typeState": "known", "approvedBy": "any",
      "disposition": "route", "catalogTarget": "poi",
      "why": "тип определён и входит в реестр — обычный путь" },
    { "id": "poi_type_unknown", "entityKind": "tourist_poi", "typeState": "unknown", "approvedBy": "any",
      "disposition": "needs_review", "catalogTarget": null,
      "why": "сущность туристическая, но чем именно является — не определено; догадка тут хуже остановки" },
    { "id": "poi_other_from_model", "entityKind": "tourist_poi", "typeState": "other_tourist_poi", "approvedBy": "model",
      "disposition": "needs_review", "catalogTarget": null,
      "why": "резервный тип от модели — это признание, что типа нет; автоимпорт с ним запрещён" },
    { "id": "poi_other_from_human", "entityKind": "tourist_poi", "typeState": "other_tourist_poi", "approvedBy": "human",
      "disposition": "route", "catalogTarget": "poi", "requiresNote": true,
      "why": "человек посмотрел и решил завести, обязательно с заметкой" },
    { "id": "accommodation", "entityKind": "accommodation", "typeState": "any", "approvedBy": "any",
      "disposition": "route", "catalogTarget": "hotel", "why": "размещение живёт в своём каталоге" },
    { "id": "food_service", "entityKind": "food_service", "typeState": "any", "approvedBy": "any",
      "disposition": "route", "catalogTarget": "restaurant", "why": "рестораны живут в своём каталоге" },
    { "id": "event", "entityKind": "event", "typeState": "any", "approvedBy": "any",
      "disposition": "route", "catalogTarget": "event", "why": "события живут в своём каталоге" },
    { "id": "experience", "entityKind": "experience", "typeState": "any", "approvedBy": "any",
      "disposition": "route", "catalogTarget": "experience",
      "why": "услуга с поставщиком, расписанием и бронью" },
    { "id": "transport_infrastructure", "entityKind": "transport_infrastructure", "typeState": "any", "approvedBy": "any",
      "disposition": "exclude", "catalogTarget": null, "excludeReason": "infrastructure_not_catalogued",
      "why": "каталога инфраструктуры нет; появится потребитель — заведём отдельным ADR" },
    { "id": "retail_shop", "entityKind": "retail_shop", "typeState": "any", "approvedBy": "any",
      "disposition": "exclude", "catalogTarget": null, "excludeReason": "not_a_destination",
      "why": "обычный магазин точкой маршрута не является" },
    { "id": "service_business", "entityKind": "service_business", "typeState": "any", "approvedBy": "any",
      "disposition": "exclude", "catalogTarget": null, "excludeReason": "not_a_destination",
      "why": "коммерческая услуга без туристической ценности" },
    { "id": "unknown", "entityKind": "unknown", "typeState": "any", "approvedBy": "any",
      "disposition": "needs_review", "catalogTarget": null,
      "why": "сущность не опознана — решает человек" }
  ],

  "poiTypeGroups": [
    { "code": "religion", "labels": { "ru": "Религия", "en": "Religion" },
      "ambiguousHints": { "ru": ["храм"], "en": ["temple"] },
      "ambiguousHintNote": "«Храм» по-русски применяют и к синтоистскому святилищу. Термин уточняет ГРУППУ и никогда не назначает тип внутри неё." },
    { "code": "culture", "labels": { "ru": "Культура", "en": "Culture" } },
    { "code": "heritage", "labels": { "ru": "Наследие", "en": "Heritage" } },
    { "code": "nature", "labels": { "ru": "Природа", "en": "Nature" } },
    { "code": "urban", "labels": { "ru": "Город", "en": "Urban" } },
    { "code": "leisure", "labels": { "ru": "Досуг", "en": "Leisure" } },
    { "code": "bathing", "labels": { "ru": "Купание", "en": "Bathing" } },
    { "code": "fallback", "labels": { "ru": "Резерв", "en": "Fallback" } }
  ],

  "poiPrimaryTypes": [
    { "code": "shinto_shrine", "group": "religion", "autoImportAllowed": true,
      "labels": { "ru": "Синтоистское святилище", "en": "Shinto Shrine" },
      "hints": { "ru": ["святилище", "дзиндзя"], "en": ["shrine", "jinja"] },
      "include": ["действующее или музеефицированное синтоистское святилище"],
      "exclude": ["магазин или кафе, у которого святилище только в адресе"] },
    { "code": "buddhist_temple", "group": "religion", "autoImportAllowed": true,
      "labels": { "ru": "Буддийский храм", "en": "Buddhist Temple" },
      "hints": { "ru": ["буддийский храм", "тэра"], "en": ["buddhist temple", "tera", "ji"] },
      "include": ["действующий или музеефицированный буддийский храм"],
      "exclude": ["ресторан или магазин с названием храма в адресе", "синтоистское святилище"] },
    { "code": "religious_site_other", "group": "religion", "autoImportAllowed": true,
      "labels": { "ru": "Другой религиозный объект", "en": "Religious Site" },
      "include": ["церковь, мечеть, объект нового религиозного движения"],
      "exclude": ["синтоистское святилище", "буддийский храм"] },

    { "code": "museum", "group": "culture", "autoImportAllowed": true,
      "labels": { "ru": "Музей", "en": "Museum" },
      "hints": { "ru": ["музей"], "en": ["museum"] },
      "include": ["постоянная экспозиция с собственным фондом"],
      "exclude": ["временная выставка без своего помещения", "сувенирный магазин при музее"] },
    { "code": "art_venue", "group": "culture", "autoImportAllowed": true,
      "labels": { "ru": "Галерея / арт-пространство", "en": "Art Venue" },
      "hints": { "ru": ["галерея"], "en": ["gallery", "art"] },
      "include": ["галерея, арт-объект, художественная площадка"],
      "exclude": ["музей с постоянным фондом"] },
    { "code": "performing_arts_venue", "group": "culture", "autoImportAllowed": true,
      "labels": { "ru": "Театр / культурная площадка", "en": "Performing Arts Venue" },
      "hints": { "ru": ["театр"], "en": ["theatre", "theater"] },
      "include": ["театр, концертный зал, площадка традиционных искусств"],
      "exclude": ["кинотеатр", "разовое представление без своей площадки"] },

    { "code": "historic_site", "group": "heritage", "autoImportAllowed": true,
      "labels": { "ru": "Историческое место", "en": "Historic Site" },
      "include": ["место события, руины, исторический квартал"],
      "exclude": ["новодел без исторической связи"] },
    { "code": "architectural_landmark", "group": "heritage", "autoImportAllowed": true,
      "labels": { "ru": "Архитектурный объект", "en": "Architectural Landmark" },
      "include": ["здание, мост или башня, ценные архитектурой"],
      "exclude": ["обычное офисное здание"] },
    { "code": "castle_fortification", "group": "heritage", "autoImportAllowed": true,
      "labels": { "ru": "Замок / фортификация", "en": "Castle" },
      "hints": { "ru": ["замок"], "en": ["castle"] },
      "include": ["замок, крепость, руины укреплений"],
      "exclude": ["отель со словом «замок» в названии"] },
    { "code": "monument_public_art", "group": "heritage", "autoImportAllowed": true,
      "labels": { "ru": "Памятник / публичное искусство", "en": "Monument" },
      "include": ["памятник, мемориал, скульптура в городской среде"],
      "exclude": ["надгробие", "экспонат внутри музея"] },

    { "code": "park_garden", "group": "nature", "autoImportAllowed": true,
      "labels": { "ru": "Сад / парк", "en": "Park & Garden" },
      "hints": { "ru": ["сад", "парк"], "en": ["garden", "park"] },
      "include": ["ландшафтный сад, городской парк, ботанический сад"],
      "exclude": ["парк развлечений", "автостоянка со словом «парк»"] },
    { "code": "natural_landmark", "group": "nature", "autoImportAllowed": true,
      "labels": { "ru": "Природная достопримечательность", "en": "Natural Landmark" },
      "include": ["гора, водопад, ущелье, природный источник, пляж"],
      "exclude": ["благоустроенный городской парк"] },
    { "code": "viewpoint", "group": "nature", "autoImportAllowed": true,
      "labels": { "ru": "Смотровая точка", "en": "Viewpoint" },
      "hints": { "ru": ["смотровая"], "en": ["observation", "viewpoint"] },
      "include": ["смотровая площадка, обзорная точка, обзорный этаж башни"],
      "exclude": ["ресторан с видом", "здание целиком"] },

    { "code": "tourist_district", "group": "urban", "autoImportAllowed": true,
      "labels": { "ru": "Туристический район", "en": "Tourist District" },
      "include": ["оформленный квартал или улица, которые сами по себе точка маршрута"],